{
  "$schema": "https://json-schema.org/draft/2020-12/schema",
  "$id": "https://game-sprite-forge.local/schemas/character-v2.schema.json",
  "title": "Forge Character Asset Spec V2",
  "type": "object",
  "additionalProperties": false,
  "required": ["schemaVersion", "kind", "id", "name", "workflow", "license"],
  "properties": {
    "schemaVersion": { "const": "2" },
    "kind": { "const": "character" },
    "id": { "type": "string", "pattern": "^[A-Za-z0-9][A-Za-z0-9_-]*$" },
    "name": { "type": "string", "minLength": 1 },
    "subject": {
      "type": "object",
      "additionalProperties": false,
      "required": ["id", "revision"],
      "properties": {
        "id": { "type": "string", "pattern": "^[A-Za-z0-9][A-Za-z0-9_-]*$" },
        "revision": { "type": "string", "pattern": "^[a-f0-9]{16}$" }
      }
    },
    "prompt": { "type": "string", "minLength": 1, "maxLength": 4000 },
    "workflow": {
      "type": "object",
      "additionalProperties": false,
      "required": ["id", "version"],
      "properties": {
        "id": { "enum": ["topdown-video", "topdown-video-locked", "topdown-video-cycle", "topdown-direction-poses", "topdown-direction-motion", "topdown-grid", "topdown-cycle", "topdown-keyframes", "topdown-keyposes", "topdown-spritesheet", "topdown-frames"] },
        "version": { "enum": ["2.0.0", "2.1.0", "2.2.0", "2.3.0", "2.4.0", "2.5.0", "3.0.0", "4.0.0", "5.0.0", "6.0.0", "7.0.0", "8.0.0", "9.0.0", "9.1.0", "9.2.0", "9.3.0", "9.4.0", "9.5.0", "10.0.0", "10.1.0"] }
      }
    },
    "cameraProfile": {
      "enum": ["topdown-orthographic@2.0.0", "topdown-three-quarter@1.0.0"]
    },
    "equipment": {
      "type": "object",
      "additionalProperties": false,
      "required": ["kind"],
      "properties": {
        "kind": { "enum": ["none", "staff_like"], "default": "none" },
        "referenceImage": { "type": "string", "minLength": 1 }
      },
      "allOf": [
        {
          "if": {
            "required": ["kind"],
            "properties": { "kind": { "const": "staff_like" } }
          },
          "then": { "required": ["referenceImage"] }
        },
        {
          "if": {
            "properties": { "kind": { "const": "none" } }
          },
          "then": { "not": { "required": ["referenceImage"] } }
        }
      ]
    },
    "motionProfile": {
      "enum": ["freeform_motion@1.0.0", "biped_walk@1.0.0", "quadruped_walk@1.0.0", "flying_cycle@1.0.0", "slither_cycle@1.0.0"]
    },
    "poseGuidance": { "enum": ["enabled", "disabled", "grayscale"], "default": "enabled" },
    "license": { "type": "string", "minLength": 1 }
  },
  "allOf": [
    {
      "if": {
        "properties": {
          "workflow": {
            "properties": { "id": { "const": "topdown-cycle" } },
            "required": ["id"]
          }
        },
        "required": ["workflow"]
      },
      "then": {
        "required": ["subject", "cameraProfile", "equipment", "motionProfile"],
        "properties": {
          "workflow": { "properties": { "version": { "enum": ["10.0.0", "10.1.0"] } } },
          "motionProfile": { "const": "biped_walk@1.0.0" },
          "poseGuidance": { "const": "disabled" }
        }
      }
    },
    {
      "if": {
        "properties": {
          "workflow": {
            "properties": { "id": { "const": "topdown-direction-motion" } },
            "required": ["id"]
          }
        },
        "required": ["workflow"]
      },
      "then": {
        "required": ["cameraProfile"],
        "anyOf": [
          { "required": ["prompt"] },
          { "required": ["subject"] }
        ],
        "properties": {
          "workflow": {
            "properties": { "version": { "const": "8.0.0" } }
          }
        }
      }
    },
    {
      "if": {
        "not": {
          "properties": {
            "workflow": {
              "properties": { "id": { "const": "topdown-direction-motion" } },
              "required": ["id"]
            }
          },
          "required": ["workflow"]
        }
      },
      "then": { "required": ["subject"] }
    },
    {
      "if": {
        "properties": {
          "workflow": {
            "properties": { "id": { "const": "topdown-direction-poses" } },
            "required": ["id"]
          }
        },
        "required": ["workflow"]
      },
      "then": {
        "required": ["cameraProfile", "equipment"],
        "properties": {
          "workflow": {
            "properties": { "version": { "const": "7.0.0" } }
          }
        }
      }
    },
    {
      "if": {
        "properties": {
          "workflow": {
            "properties": { "id": { "const": "topdown-grid" } },
            "required": ["id"]
          }
        },
        "required": ["workflow"]
      },
      "then": {
        "required": ["subject", "cameraProfile", "equipment"],
        "properties": {
          "workflow": {
            "properties": { "version": { "enum": ["9.0.0", "9.1.0", "9.2.0", "9.3.0", "9.4.0", "9.5.0"] } }
          }
        }
      }
    },
    {
      "if": {
        "properties": {
          "workflow": {
            "properties": { "id": { "const": "topdown-video" } },
            "required": ["id"]
          }
        },
        "required": ["workflow"]
      },
      "then": {
        "required": ["cameraProfile", "equipment"],
        "properties": {
          "workflow": {
            "properties": { "version": { "const": "2.0.0" } }
          }
        }
      }
    },
    {
      "if": {
        "properties": {
          "workflow": {
            "properties": { "id": { "const": "topdown-video-cycle" } },
            "required": ["id"]
          }
        },
        "required": ["workflow"]
      },
      "then": {
        "required": ["cameraProfile", "equipment"],
        "properties": {
          "workflow": {
            "properties": { "version": { "const": "6.0.0" } }
          }
        }
      }
    },
    {
      "if": {
        "properties": {
          "workflow": {
            "properties": { "id": { "const": "topdown-video-locked" } },
            "required": ["id"]
          }
        },
        "required": ["workflow"]
      },
      "then": {
        "required": ["cameraProfile", "equipment"],
        "properties": {
          "workflow": {
            "properties": { "version": { "const": "5.0.0" } }
          }
        }
      }
    },
    {
      "if": {
        "properties": {
          "workflow": {
            "properties": { "version": { "enum": ["2.2.0", "2.3.0", "2.4.0", "2.5.0", "3.0.0", "4.0.0", "5.0.0", "6.0.0", "7.0.0"] } },
            "required": ["version"]
          }
        },
        "required": ["workflow"]
      },
      "then": { "required": ["equipment"] }
    }
  ]
}
