{
  "schemaVersion": "2",
  "kind": "character",
  "id": "fixture-ranger-spritesheet",
  "name": "Fixture Ranger Sprite Sheet",
  "subject": {
    "id": "fixture-ranger",
    "revision": "REPLACE_WITH_SUBJECT_REVISION"
  },
  "workflow": {
    "id": "topdown-spritesheet",
    "version": "3.0.0"
  },
  "equipment": {
    "kind": "none"
  },
  "license": "MIT"
}
