{
  "schemaVersion": "2",
  "kind": "character",
  "id": "fixture-ranger-keyposes",
  "name": "Fixture Ranger Key Poses",
  "subject": {
    "id": "fixture-ranger",
    "revision": "REPLACE_WITH_SUBJECT_REVISION"
  },
  "workflow": {
    "id": "topdown-keyposes",
    "version": "2.5.0"
  },
  "equipment": {
    "kind": "none"
  },
  "license": "MIT"
}
